{
  "schema_version": "2.0.0",
  "scope": "clip",
  "identity_contract": "fixed-six-per-team",
  "slots_per_team": 6,
  "descriptor_recipe": {
    "name": "nested-part-adaptation",
    "version": "1.0.0",
    "selection_protocol": "past-only-nested-leave-one-clip-out",
    "roster_contract": "fixed-six-per-team",
    "modalities": [
      { "name": "dino", "dimension": 384 },
      { "name": "osnet", "dimension": 512 },
      { "name": "kpr", "dimension": 4096 },
      { "name": "kpr_prompt", "dimension": 4096, "pose_failure": "prompt-free-fallback" }
    ]
  },
  "tracklets": [
    {
      "canonical_track_id": 7,
      "track_ids": [7, 19],
      "court_side": "left",
      "median_court_pos": [0.25, 0.62],
      "first_frame_index": "0",
      "last_frame_index": "120",
      "sample_count": 24,
      "mean_quality": 0.94,
      "prompt_coverage": 0.75,
      "descriptors": null,
      "cannot_link_canonical_track_ids": [8]
    },
    {
      "canonical_track_id": 8,
      "track_ids": [8],
      "court_side": "left",
      "median_court_pos": [0.32, 0.38],
      "first_frame_index": "0",
      "last_frame_index": "120",
      "sample_count": 22,
      "mean_quality": 0.91,
      "prompt_coverage": 0.5,
      "descriptors": null,
      "cannot_link_canonical_track_ids": [7]
    }
  ]
}
